Identifier,Type,SKU,Name,Published,IsFeatured,VisibilityInCatalogue,ShortDescription,Description,TaxStatus,InStock,AllowCustomerReviews,Price,Categories,Tags,Images,ExternalURL,Position
0,external,B00NMFDE3K,Never Forget Sarcastic Graphic Music Novelty Funny T Shirt,1,0,visible,"AWESOME FIT: Fits True to size, great fit and feel - Wash with cold water, inside out. Want to make dad look like a super star? This shirt has a great look and cool fit. | TOP QUALITY: Our Graphic Tees are Professionally screen printed and designed in the USA by Feelin' Good Tees. Nothing beats our outstanding selection of funny sarcastic t shirts! The shirt will make for great father's day gifts , birthday present , gift for a friend , a dad gifts, Christmas gift idea or even a gift to yourself. | GREAT FEEL: All shirts are 100% preshrunk cotton with the following exceptions; Ash Grey is 99/1 cotton/polyester; Sport Grey is 90/10 cotton/polyester if available. . Available in 2XL, 3XL, 4XL and 5XL This tee will bring the adult humor out in the best of them. The sarcasm and laughs will flow with this t-shirt. This graphic t shirt makes are a great gift for dad. | HAVE FUN: Get your humor mode on with this fun t shirt. We have the best funny t-shirts. With sarcastic and novelty all built into one tee shirt. Looking for that Birthday tshirt or just the best cotton men’s tee, you found it. This is a great ice breaker when it comes to meeting someone. You will love the soft feel and you will probably want to wear it day and night…nothing beat an old school t shirts that you can sleep in all night and odds are with this shirt, it won’t be alone. | MAKES A GREAT GIFT: See all our funny tshirts! This graphic tee makes the best gift idea for you or a friend. Perfect for Christmas, Father’s Day for Dad, Mother’s Day for Mom, gift idea for friends, the perfect idea for your brother or sister. The welcome home gift they will love. These are long lasting tees, something that you can wear to a party or just a simple movie. Give them a very funny t shirt, it is something they will wear all year. Make sure it is a Feeling Good Tees. | ","Never Forget Funny T-Shirt. The best part is when you pull this shirt over your head you become the center of attention. The finest quality cotton tee. They fit great, preshrunk and we only use brand name tees. The t-shirts are heavy weight cotton tees. We have over 1000 designs. Check out our store for more funny and novelty t shirts that will become your favorite.",taxable,100,1,$6.99,Fashion,,https://images-na.ssl-images-amazon.com/images/I/613BhdinLuL._UL1200_.jpg,https://www.amazon.com/dp/B00NMFDE3K?tag=vttgreat-20,0
0,external,B07CYCPHRM,The Office TV Show Dunder Mifflin Paper Men's Royal Blue T-Shirt,1,0,visible,"100% Cotton (Except for Heathered Colors) | 100% Cotton Preshrunk Jersey Knit t-shirt | Double needle sleeves and hems | Seamless double-needle 7/8"" collar | This item is not affiliated with any existing intellectual property or trademark unless specified in the Product Description. | ","This super nice t-shirt is made of 100% cotton (except for heathered colors like Sport Gray or Ash Gray, which may have up to 10% poly) and features double needle sleeves and hems, a seamless double needle 7/8 inch collar, and is PRESHRUNK. It has taped neck and shoulders, and the lay of the fabric has been quarter turned to eliminate the center crease. Certain styles also feature tearaway labels. This item is available in sizes SMALL through 3XL. It is a standard ADULT UNISEX CUT, which means it is not fitted. This is a very comfortable shirt and it should last you for years and years to come.",taxable,100,1,$6.99,Fashion,,https://images-na.ssl-images-amazon.com/images/I/61genc5VzmL._UL1024_.jpg,https://www.amazon.com/dp/B07CYCPHRM?tag=vttgreat-20,0
0,external,B076124BKM,"Gildan Men's Ultra Cotton Adult T-Shirt, 2-Pack",1,0,visible,"Solids: 100% Cotton; Sport Grey And Antique Heather: 90% Cotton, 10% Polyester; Safety Colors And Heather: 50% Cotton, 50% Polyester | Imported | No Closure closure | Machine Wash | Industry leading assortment of colors | Soft premium cotton for added comfort | Double needle stitching in sleeves and bottom hem for extra durability | Classic cut for roomier fit | ","Gildan is one of the world's largest vertically integrated manufacturers of apparel and socks. Gildan uses cotton grown in the USA, which represents the best combination of quality and value for Gildan cotton and cotton blended products. Since 2009, Gildan has proudly displayed the cotton USA mark, licensed by cotton council international, on consumer's product packaging and shipping materials. Gildan environmental program accomplishes two core objectives: reduce our environmental impact and preserve the natural Resources being used in our manufacturing process. At all operating levels, Gildan is aware of the fact that we operate as a part of a greater unit: the environment in which we live and work.",taxable,100,1,$4.76,Fashion,,https://images-na.ssl-images-amazon.com/images/I/71HuLCyNNhL._UL1500_.jpg,https://www.amazon.com/dp/B076124BKM?tag=vttgreat-20,0
0,external,B004OWH4OU,Next Level Mens T-Shirt,1,0,visible,"60% cotton, 40% polyester | Imported | Pull On closure | Fabric laundered, 4.3 oz., 60/40 combed ringspun cotton/polyester, 32 singles. | Set-in CVC 1x1 baby rib collar. | Tearaway label*. | ","Fabric laundered, 4.3 oz., 60/40combed ringspun cotton/polyester, 32 singles. Set-in CVC 1x1 baby rib collar. Side seamed. Tearaway label.",taxable,100,1,$1.99,Fashion,,https://images-na.ssl-images-amazon.com/images/I/71ou0JOysBL._UL1500_.jpg,https://www.amazon.com/dp/B004OWH4OU?tag=vttgreat-20,0
0,external,B06XWLMYVY,Goodthreads Men's Short-Sleeve Crewneck Cotton T-Shirt,1,0,visible,"100% Cotton | Imported | Machine Wash | Great for layering or wearing alone, this smooth cotton T-shirt features a ribbed crewneck, straight hem, short sleeves, and a tag-free neck for everyday comfort | Model is 6'2"" and wearing a size M | Our fit is comparable to t-shirts from J.Crew and Banana Republic | ","An Amazon brand - Great for layering or wearing alone, this smooth cotton T-shirt features a ribbed crewneck, straight hem, short sleeves, and a tag-free neck for everyday comfort",taxable,100,1,$14.42,Fashion,,https://images-na.ssl-images-amazon.com/images/I/9156HfpWSjL._UL1500_.jpg,https://www.amazon.com/dp/B06XWLMYVY?tag=vttgreat-20,0
0,external,B077ZKDQLV,Gildan Men's Assorted Crew T-Shirt Multipack,1,0,visible,"Solids: 100% Cotton; Sport Grey: 90% Cotton, 10% Polyester | Moisture wicking - keeps you cool and dry | Taped neck and shoulders for durability; Tubular rib collar for better stretch and recovery | Feels soft to the touch; Tag-free; Lays flat | 5 pack = SM-XL; 4 pack = 2X (Colors may vary) | ","Gildan is one of the world's largest vertically integrated manufacturers of apparel and socks. Gildan uses cotton grown in the USA, which represents the best combination of quality and value for Gildan cotton and cotton blended products. Since 2009, Gildan has proudly displayed the cotton USA mark, licensed by cotton council international, on consumer's product packaging and shipping materials. Gildan environmental program accomplishes two core objectives: reduce our environmental impact and preserve the natural Resources being used in our manufacturing process. At all operating levels, Gildan is aware of the fact that we operate as a part of a greater unit: the environment in which we live and work.",taxable,100,1,$10.50,Fashion,,https://images-na.ssl-images-amazon.com/images/I/710o0VupScL._UL1500_.jpg,https://www.amazon.com/dp/B077ZKDQLV?tag=vttgreat-20,0
0,external,B07KRTRKWJ,Cleverland-Baker I Woke Up Feeling Dangerous Football Jersey Tshirts,1,0,visible,"Cleveland football baker t-shirt for mayfield-fans, browns mom dad son daughter husband wife, number 6 jersey | If you're a browns-fans and love this football quarterback player then you might want this tee | Wear this t-shirt to a fantasy football draft party, on game day, to a tailgate party, a cookout, or to watch football with friends. | Uncle Jam is the exclusively owner and dealer of this product. Made and Shipping From USA by Uncle Jam shop. All the same designed clothing from unknown dealers are fake and we will not take responsible for any problems of low quality or slow delivery. | ","Coming to Uncle Jam you can choose as you like apparel favorite among thousands of designs from design professionals around the world. We have many kinds of clothes, you can choose for you, your family, relatives, for companies. We can be bringing you your favorite designs then. A customized product will be super nice gifts for your family members or friends on birthday, Father's Day, Mother's Day, Memorial Day, Thanksgiving, Halloween, Christmas, New Years, retirement, anniversary or any occasion. We really want to bring not only qualities, good designs but also the best feeling to our customers. We can't refund or change another one If you chose wrong size. Please make sure exactly your size. If you have any questions please contact us. We would respond to you as soon as possible.",taxable,100,1,$17.95,Fashion,,https://images-na.ssl-images-amazon.com/images/I/611lSQAQvFL._UL1000_.jpg,https://www.amazon.com/dp/B07KRTRKWJ?tag=vttgreat-20,0
0,external,B07BB7Y6Z7,Fruit of the Loom Men's Crew Neck T-Shirt Multipack,1,0,visible,100% Cotton | Imported | Pull On closure | Machine Wash | Black 100% Cotton and Grey 90% Cotton 10% Polyester | Generous length and full cut | 4 pack includes 2 grey and 2 black shirts | ,"Fruit of the Loom men's crews work great alone or to add an extra layer under a button-down or polo shirt. This shirt eliminates ride-up, it stays neatly tucked so you can go about your busy day with confidence. They are designed to maintain comfort and softness even after many washes. The improved, double-stitched collar stays flat and keeps its shape, providing a consistent look. This Fruit of the Loom t-shirt features a tag free designed to provide all-day comfort. There are soft covered seams on the neck and shoulders for extra comfort. Wear layered or by itself. Available in a variety of sizes, you can choose the ideal one for your body.",taxable,100,1,$14.96,Fashion,,https://images-na.ssl-images-amazon.com/images/I/91xhRGVGjdL._UL1500_.jpg,https://www.amazon.com/dp/B07BB7Y6Z7?tag=vttgreat-20,0
0,external,B075315TXT,Dion Wear American Warrior Flag Skull Military T-Shirt,1,0,visible,Designed & printed with pride in USA! | 5.3 oz. 100% preshrunk cotton tee | Machine washable | Short Sleeve | True-fit shirt | ,"Dion Wear® original American Warrior Flag design on the front of the shirt with smaller Dion Wear® logo on the right sleeve and American flag on the left sleeve. This is a 5.3 oz. true fit shirt perfect for any occasion. Shirt is printed using top quality all around, not the cheap imitation that you find elsewhere. Each t-shirt is tagged and wrapped. Screen printed using high quality inks and fully cured. Printed with pride in the USA!",taxable,100,1,$13.99,Fashion,,https://images-na.ssl-images-amazon.com/images/I/61y%2BChPYe9L._UL1000_.jpg,https://www.amazon.com/dp/B075315TXT?tag=vttgreat-20,0
0,external,B07L6HYG78,This is My Hallmark Christmas Movie Watching Shirt Women Long Sleeve Christmas Graphic Raglan Baseball Tee Shirts Top,1,0,visible,"Material: Cotton Blend,Soft And Comfortable | Feature: This Is My Hallmark Christmas Movies Watching Shirt, Women Funny Cute Christmas Shirt, Women Christmas Raglan Baseball Tee Shirt, Letter Print Tee Shirts For Women. | Perfect for Casual Sports or Daily,Good Choice To Match With Your Favorite Skinny Jeans Shorts Leggings or Boots,and so on. | Hand/Machine Wash Cold Water, Do Not Dry Clean, Do Not Drying, Not Bleach. | A Great Gift For A Birthday, Anniversary, Valentine's Day, Christmas, Mothers'day, Thanksgiving, Easter or Halloween Costume. | ",,taxable,100,1,$16.99,Fashion,,https://images-na.ssl-images-amazon.com/images/I/61R1NNCnnJL._UL1197_.jpg,https://www.amazon.com/dp/B07L6HYG78?tag=vttgreat-20,0
